[
  {
    "corpusId": "lincoln-deep-28",
    "corpusName": "Lincoln Deep Corpus (28-document reviewed baseline; LMA v4 inventories complete)",
    "corpusType": "deep-case",
    "originModuleId": "lincoln-metaphor-analysis",
    "caseIds": ["american-civil-war-union"],
    "documentCount": 28,
    "samplingFrame": "Core 28-document reviewed baseline drawn from Abraham Lincoln's speeches, letters, and public addresses (1838-1865), fully annotated in lincoln-metaphor-analysis. LMA v4 source inventories are complete through the non-human-review boundary: 48 core documents, 78 validation-tier documents, and 18 additional search-only reference documents. PPW currently registers 36 document metadata records; additional LMA v4 records require PPW source-pack mapping, raw-text import, segmentation, annotation/reliability review, and claim-promotion gates before they become PPW evidence.",
    "corpusPurpose": "core",
    "rightsStatus": "fair-use",
    "normalizationStatus": "pending",
    "segmentationStatus": "pending",
    "annotationStatus": "pending",
    "reliabilityStatus": "pending",
    "claimPromotionStatus": "not-started",
    "sourceIssueMigrationStatus": "in-progress",
    "sourceIssueRefs": [
      "github:ashitaka-emishi/political-pathology-workbench#195",
      "github:ashitaka-emishi/political-pathology-workbench#196",
      "github:ashitaka-emishi/political-pathology-workbench#197",
      "github:ashitaka-emishi/political-pathology-workbench#198"
    ],
    "notes": "PPW #195, #196, and #197 remain the PPW migration anchors for the LMA v4 corpus tiers. The child repository now contains completed source inventories for LMA #113 (48-document core), LMA #114 (78-document validation inventory), and LMA #115 (18 additional search-only reference records). PPW evidence-readiness status remains pending: raw text import, passage segmentation, annotation, human/inter-annotator review, scoring, and claim promotion are not implied by inventory completion.",
    "registeredDocumentCount": 36,
    "sourceInventoryCounts": {
      "lmaV4Core": 48,
      "lmaV4Validation": 78,
      "lmaV4ReferenceAdditional": 18
    }
  },
  {
    "corpusId": "sacrifice-law-comparative-41",
    "corpusName": "Sacrifice Law Comparative Corpus (41-document set)",
    "corpusType": "comparative",
    "originModuleId": "sacrifice-law-workbench",
    "caseIds": ["american-civil-war-union", "nazi-germany"],
    "documentCount": 41,
    "samplingFrame": "41-document stratified corpus spanning American Revolution, Napoleonic, Lincoln, and Nazi-era cases under Koenigsberg's Law of Sacrifice, selected via the sacrifice-law-workbench manifest-driven pipeline. PPW #149 records proposed PPW case IDs for American Revolution and Napoleon; both still require case folders before their subsets can be imported. Corpus import into PPW is planned for Milestone 17.",
    "corpusPurpose": "core",
    "rightsStatus": "fair-use",
    "normalizationStatus": "pending",
    "segmentationStatus": "pending",
    "annotationStatus": "pending",
    "reliabilityStatus": "pending",
    "claimPromotionStatus": "not-started",
    "sourceIssueMigrationStatus": "in-progress",
    "sourceIssueRefs": [
      "github:ashitaka-emishi/political-pathology-workbench#138",
      "github:ashitaka-emishi/political-pathology-workbench#149",
      "github:ashitaka-emishi/political-pathology-workbench#150",
      "github:ashitaka-emishi/political-pathology-workbench#151",
      "github:ashitaka-emishi/political-pathology-workbench#154",
      "github:ashitaka-emishi/political-pathology-workbench#192"
    ],
    "notes": "American Revolution and Napoleon have proposed PPW case IDs in data/corpora/sacrifice-law-comparative-41/cases.json, but the corresponding PPW case folders do not yet exist. Corpus import planned for Milestone 17. No documents imported yet as of Milestone 15; per-corpus folder created in PPW #138."
  }
]
